id,reviewContent
1,"I got this phone on Friday evening.

Pros:
Great battery life
Amazing performance
Premium design
Impressive rear and front camera
In display fingerprint scanner is really fast

Cons:
No headphone jack but you'll get a converter
No notification LED
No microSD card slot
"
2,"Camera quality is not upto the mark. I visited one plus store and the store representative checked my phone and compared the camera quality with his demo phone. He noticed a significant difference between the two.
I request Amazon to replace my phone with a new one as it is evident that this phone has some problems."
3," The Battery lasts max of 6 hours.
Major application not working in the upper side of the screen.
 Camera quality is very poor.
 Audio output through earphone is very poor, same earphone works with other phone is excellent.
 While in a call unable to drop down the notification window.
 Video quality is very poor compared to other less price phones.
I have applied for replacement, not going to take any replacement for such a worst product."
4,One plus 6 was costing 28k during the big billion sale and 6T costs 38k. It is not worth to spend 10 k just for some small improvements.
5,I ordered one plus 6t phone today I got delivered wen I opened found that ear phones missing in the boxes plz let me clear the issue
6,Phone is simply superb in all aspects...low light performance of the camera is outstanding...you simply cannot go wrong with this phone
7,Only one side of speakers is working. Right side is not working
8,After replace the handset issue was resolved. Now i unlocked the speed i need.
9,"Got delivered in just 2.5 hours of my order. No bad overservations yet. Fingerprint unlock is also good, if you have face unlock ON then all the time it will unlock with face data before the the fingerprint works."
10,"Two days back I received 6T and had many problems with the mobileThe mobile is getting heated when it's on camera mode or doing nothing., and while using mobile it's getting struck.. I don't think I got an original set, I'm sure it's a duplicate set.
Please for god sake please exchange my mobile with a new one"
11,"Amazing phone, just feels good.
Done the ma+h, price isn't everything.
You get what you pay for. :)

Excellent battery,
Great screen,
Amazing performance,
Smoooth OS,
Great camera,
Surprisingly decent audio,
Cool screen unlock and ridiculously fast face unlock.

The phone is worth every penny spent."
12,"The device is very bad. Camera quality is very poor. Please don't buy it guys go for Apple iPhone XS instead. Apple has a far better Camera.
No Color options in 256gb variant. OnePlus should learn from Apple they have a lot of Color options at the time of launch. OnePlus is not worth the price."
13,"This has by far been the best phone I have ever used hands-on. Flagship Specs, Classy look, Premium Packaging and the Speed you Need!
Appearance - The device looks very much similar to the OnePlus 6T upfront but it has got the speed orange highlights at the back, carbon finish and McLaren Branding at the bottom.
Camera - The night mode really captures amazing pictures and the portrait mode is just amazing. The low light photography could still be improved.
Battery - With average usage with full day data on, it easily lasts upto 2 days. The Warp charging is just amazing, it takes around 40-45 mins to charge from 0-100%. But you could easily get a day's charge within 20 mins.
Speed - With 10 Gigs of RAM, speed should not be a question. You could open up 5 high specs games and it still wouldn't lag. And its bragging rights for sure!

Overall, I am really satisfied with this device and feels great to be a part of OnePlus Community! Go, get it! Its for those, who are in continuous pursuit for speed!"
14,Camera pics are not having good quality. Pixel is not clear
15,"The in-display fingerprint sensor is very bad. It is slow and many times it takes multiple attempts to scan the finger. This phone is big disappointment. I would not recommend this phone at all. They didn't give headphone jack which is okay as they were giving free bullets V2 for those who pre-booked the phone. But they should atleast have given IP rating as IP gives peace of mind and stereo speaker should have been there instead of dummy holes at bottom. Needless to say that Oneplus phones have good software and this one is no exception. This has good software which is fast and fluid. My point is that don't buy this phone for fingerprint sensor. If you are having other OnePlus phone then you should hold for next OnePlus phone.
106 people found this helpful"
16,Issue with the Camera Slow Motion Mode is Not Working in Home Black Shade is Moving from left to right Sound Quality is not that good
17,"Very nice and fantastic phn, the best smart phn till date, awesome camera good battery life"
18,"Battery-Extremely Poor
Camera-Satisfactory
Look-Good
Weight-Good
Sound-Superb
Overall I would have given it half star,deeply through by it's battery.
And even after the replacement,the same problem persists,which means it's a clear cut case of faulty manufacturing.
Please don't buy it,if you really love your hard earned money...."
19,I like its full display and picture quality is good but temperd glass should be given to all customers
20,mobile is very good and fast.but battery is draining like anythg..within two days of usage i found battery consumption is more than my old phone redmi note4
21,"Google Play does not work properly, apps are downloading after 3-4 attempts.. Very Heavy and does not fit well in hands
Very poor quality of preapplied screen guard. Bubbles came only after 30 minutes of usage
Camera is very ordinary"
22,"Used it for close to 45 days now, overall a very good phone but for this price point i would expect much better camera. Since Asus Zenfone 5Z also gives similar performance at almost less than 10K. Camera in night mode needs more improvement and does not capture the picture properly .. may be i need to do some tweeks in settings i am not sure. Please see the image i uploaded the fire is tarnished with grey .. same picture without night mode is much better. This is my first 1+ phone .. satisfied but because of camera giving 4 stars."
23,"Crisp picture quality, impactful sound and an impressive battery life makes it a worthy investment. A blind buy for those who plan to upgrade to OnePlus from others...
Fingerprint sensor, face unlock are exciting features but not indispensible.
All in all its a fair deal if the base variant itself is 128gb!! What more can u ask for!!
I'm happy...
N yes...Thank you Amazon for the On time delivery.."
24,"Bought the costliest one. 8gb 256gb model.
Received a phone with flickering screen, screen shows different colors every now and then... Battery drains fast and phone heats up even on normal usage. I have used OP3t for 2 years and never faced any problem. But This one didnt stay even for 2 days and I had to request for replacement. 1 day passed and no help, finally anazon says replacement not possible, only refund possible. I hope at least the refund process goes smooth.
50 people found this helpful
"
25,Brightness is very low. I was using OnePlus 5. 20% of brightness in OnePlus 5 is equal to 65% brightness in 6T which may cause in draining the battery. Not happy with it. Also unlocking with fingerprint is not up to the mark. Totally not so happy with it. Thinking to return it and use OnePlus 5 only
26,"First and foremost...I really dont miss those 3.5 mm jack. Using bluetooth earpiece and the sound quality is top notch.

Picture quality - initial shots taken are impressive.
Battery life is best among all one plus phones.

Build quality is superb. No issues with call clarity and now the best part...Oxygen OS. Its buttery smooth, fluidic and unputdownable. You will ne addicted to it.

Only con is the weight of the device."
27,"Phone is getting hanged and face unlock is not working. I received a phone on 8th November and logged a call with amazon on 9th november that my phone is getting hanged frequently and face unlock is not working properly.

 They have scheduled the technician visit on 11th November, however, technician not visited. I called amazon related technician, executive told me that technician not visited due to some personal reasons. They don't bother to inform customer if technician are not going to visit."
28,"Impressive at this price point. Only disappointment is absence 3.5 mm headphone jack. Had Oneplus supplied bullets headphone as default accessory, it would have been a complete package. Apple, learn from it, else your days are numbered."
29,"I pre-ordered the phone on 9th Oct and literally waited for more than a month for this phone. It was worth waiting.
Phone looks similar to one plus 6 however the technology you get in this phone is updated and is latest. The notch looks beautiful compared to other waterdrop notch phones. I'm not an audiphile so can't complain much about the removal of headphone jack. I'm pretty comfortable with wireless earphones. The OS is something which needs to be considered the most on a phone, which most of the people ignore. I migrated from a Sony phone and see a huge difference in the usage, the OS is smooth as butter and is calibrated for daily driver. You can perform many tasks at a snap of your fingers and never experience a lag on the phone. Camera is good, clicks are clear. Portrait and night mode are very useful and handy. Slow motion works well. Battery life is comparably good, you get around 6 hrs of SOT from a full charge. I feel that's more than enough for a daily driver and works well for gamers. Charging is pretty fast you can charge the phone from 0 to 100 in 1 hr 20min.

I feel it's worth paying 40k for a premium phone like this, which offers good support for your OS and provides Android updates for 2 yrs. Rather than spending 25k+ for plastic and non premium phones. BTW this comes with no bloatware and is completely based on stock OS which contains a lot of tweaks and customizatios. That's the best part of the phone.
Go for it if you don't want to compromise !!"
30,"Don't buy this Mobile worst network connectivity also no support any service centres, in Maharashtra only 4 services centre unfortunately at my location 300 km from me I was so sad call centre suggest me you visit to service centre to resolve issues .....very slow browsing like 2G phones ...... camera is good but without connecting network it's like only photographer camera..."
31,"Pros: Hardware supports good speed and camera.
Cons: Screen unlock doesn't work most of the time. Fingerprint is not upto mark and takes a few tries. Also Google smart Lock is not working. There was a defect on the screen protector applied and Amazon says that they product will not be replaced and they cannot do anything about it. Oneplus says buy a new tempered glass and put it!! Fingerprint sensor is hardly able to cope with the normal plastic protector. I don't know how will it work with a thick one. This was the first time I had problem with a product from Amazon and they showed their true colors. Sameer goes for OnePlus."
32,Super nice
33,Phone is not working after update.I need immediate replacement or need my money back without further delay.
34,Great for all specs except for the battery life. Battery drains faster than expected. Without that totally worth it…
35,"If yuh are a Iphone user please stay away.,
Yu’ll definetely nt like it"
36,"Picture quality is good. Battery life is decent. Sound quality is okay. It's not a beast in any regards considering it's price and the flagship killer tag. You may miss the notification led and the 3.5 mm audio jack. The in screen fingerprint reader is a cool feature but surely feels that first gen not so smooth feature. It just gives you the feeling of not buying a finished product but a work in progress kind of a thing. Not many things to complaint about since it does give you good specifications for a decent price but.. it's no longer a flagship killer to stay. One plus may very well be the new apple. I'd hate to see that happen, but they're in the business for profit afterall. It can't always all be about the community. But I see them get run over by budget phones if their competition could maintain quality"
37,Everything is good about the phone except some software bugs like gestures dnt work flawlessly and i have issue with paint coming out from the top part of the phone near the ear piece
38,One plus 6 is better than 6t
39,"I just got the new one plus 6t. But not received all other accessories with it. Only received one charger , one protective case that s it. Type C to audio adapter is missing."
40,Very disappointed with slow mo camera quality. I wish I could return the phone.
41,"Worst product i ordered on 1st november 2018 at 00.01 hours i got the product but only ised 1 day and now the phone is not charging and the phone is dead.
Dint expect such a baaaaaaddd product.
I always used one plus but from now onwardd no one plus"
42,I just unlocked the speed today but it disappointed me I can't download apps it takes forever to download for a brand which promotes that it is very fast really disappointed.the battery also drains really fast really disappointed with the phone .I don't recommend this phone at all it also force close few apps after normal use of apps
43,battery drain issue
44,"I got this phone with a minor scratches on the pre installed screen protector, however I'm not sure if those are on the protector or the screen itself. I couldnt file a complain since I am travelling constantly. Will obviously reach out you guys once I'm getting back home."
45,"Please don't buy..gets heated, doesn't start
Customer care has no interest pls don't buy 6t worst one plus product"
46,The whole product is good but 36k is more for it
47,It is not worth for the money. Low light camera performance still low. 25K poco does equal to 6T. In display finger print is laggy. You definitely won't like it. Good battery life.Average display. Performance is good.
48,Build quality is good. Phone is looking handsome. Two things bothering me. one is notification light. There is no notification light on top of screen so I need to awake my phone everytime to check any message or so. Second thing is fingerprint sensor. It is very sensible I must say unlike the back one. I need to put my finger in proper way otherwise I won't be able to unlock my phone.
49,"The phone got stuck while using one of camera features. Its not even getting restarted. The screen is freezed thus, not allowing to proceed further. Hope i get a replacement soon."
50,"Takes too long to charge...took 80minutes to charge from 10%-96%.
Battery life went down from 100%to 10% in less than 20hours without much usage.
Fingerprint sensor not very receptive."
51,I have not received headphones as promised by pre book OnePlus 6t
52," Picture quality zero third class
 Heat while charging
heat issue while playing game like pubg
 Slipry grip
 Heavy weight
 Camera in night also wrost
 When you zoom picture taken by 6t shows the blur images and red eyes
 There lack of A. I artificial intelligence
 Face lock security is totaly unsafe i tried open with my passport size foto & opend screen lock
 Battery life is good fast charging but heating issue also
 No headfone jack you have to manage with charging jack adapter of headfone
I return after using 2 days & thanks to amazone to refund on time and saves my money by return / refund policy"
53,"Speaker is not working, not happy with the product. I have placed request for replacement but haven't received any confirmation from Amazon yet. Very disappointed."
54,"If you are a op5,op5t or op6 user it is not worth upgrading
cons of oneplus 6t:
1 the indisplay fingerprint is way too slow and does not work always
2 the phone still has some network connectivity issues(s/w upgrades may fix them)
3 phone works fast BUT expensive for the price and lacks good features like IR blaster,gloves mode, only limited gestures
4 it seems interesting for a week, later its just a normal budget phone
5 the low light photos in 'nightscape' is still bad,overall camera is just OK(not as hyped )
Pros:
1 Phone feels more premium than Rs.25,000 phones but still does not provide the vibe of apple or samsung(note & S series)
2 has good customer care support (especially online)
3 the software(oxygen OS) is really smooth,no lags at all
for those looking for phones for at least 2-3 years of usage,if possible wait for oneplus 7
hope to see a triple rear camera and 5G on oneplus7"
55,"Coming from OnePlus 2, this is a huge upgrade. So I liked many things about this phone. Amazing display. I'm not a notch fan but this is the cutest notch I've seen. Absence of 3.5mm jack might be a let down for many fans including me and I still don't agree with their decision. There is no LED notifications also.

Performance wise there's no need of even comparing because this is the best (SD845+OxygenOS+8GB RAM = TRUE WONDER).

Didn't get a chance to test the camera much, so no comments on the camera.

Some might face problems with fingerprint scanner but register them properly and you would not get any problems. I had none till now.

I didn't think that the case in the box would be so good. It's very nice and I've seen phone dropping from 10ft not breaking with this case.
Many intrusive ads are comparing this with Pocophone F1. I just laugh at them. OnePlus has a way more premium feel than Pocophone."
56,"Best phone !!!
In love with the fingerprint scanner and it's animation !
Battery lasts one day !
Industry leading camera with studio mode works fantastic !
Catchy display !
Fast like a flash !
Great Value for money !!!!!"
57,"Received faulty piece of mobile, battery can't even last for 6 hours, I am going to return it"
58,"very poor product from one plus and neither amazon is replacing the device battery didn't last long much not even 5 or 6 hours the device is malfunctioning like opening apps on it's own and volume is increasing or decreasing on it's own
not satisfied with the product"
59,"There are two speakers in One Plus 6T, One speaker is not working"
60,"DESIGN:
If you thinking that OnePlus 6 and 6T has no major difference than you are absolutely wrong and highly mistaken if you thing 6 is better than 6T. Price hike is completely justified.

Visible differences between 6 & 6T:
Higher screen to body ratio, Gorilla Glass 6, in-display fingerprint scanner, taller, water-drop notch. 3700mAh battery.

Technical advancement:
Advance AI which smartly uses your RAM and ROM which actually boosts the performance, Better heat-sink than 6.

CAMERA:
I took my canon 1300D with two lens; portrait and 18-55 and OnePlus6T for comparison test. OnePlus 6T provided better results when both on Auto-mode. It has amazing contrast, perfect saturation; but the thing where it stood-out from others its it night picture quality. It does wonders even if there is almost no light and that is some magic over there. Front camera absolutely stunning and comes with screen flash for low light selfies.
BATTERY:
Battery charging- 0 to 65% in 30 mins and at 45 min it reaches 86%. Full charge by 1hr8 mins when internet, Bluetooth and wifi off. On heavy use it survives 8 hrs (I watched 2 movies in HD with 50% screen brightness and 1 hour PubG gaming on HD, 1 hour YouTubing). On average usage, 17 hours very smoothly(casual social media surfing, browsing, camera usage about 5 to 6 pictures using flash). Without internet usage at all and battery saver on, it can go whooping 3 DAYS !

SPEAKERS:
External speakers are loud, I mean really very loud. Hearing speaker is very cool by its looks and loud too. Volume rockers and power switch is perfectly hard.

SECURITY:
Though I feel face detection is worst type of security because it has many drawbacks, its quick. And finger print scanner is also faster than its competitors. The part which irritates is that while using at night in dark, for face and fingerprint detection, the display gets 100% to scan which is very annoying and very uneasy for eyes."
61,"I am a big fan of Apple. Have been using Iphone from last 5 years. Wanted to change the phone to the new one. But not much of Innovation from Apple. So, I switched to Oneplus and Oneplus 6T was a best replacement.
The OnePlus 6T brings new technology and worthwhile improvements to the table making this the best phone from OnePlus yet.
Design: Just gorgeous - the curve of the camera bump is more of a design accent than a notch. The phone has a huge 6.41 in screen, but is still easily managed with one hand. The color is amazing - Mirror Black. The 6T feels like it was meant to fit in my hand. The first party OnePlus cases accent the amazing design and make it even more comfortable. When you hold the phone, you will know exactly what I mean!

Battery: Lasts more than a day with heavy use. I can get almost 6 hrs of screen on time even after watching YouTube, gaming, and general usage. Even better, the included dash charger fills the battery extremely quickly. No wireless charging, but I don't even miss it.

Camera: Solid - 4K 60FPS video looks great. Other phones in this price range can't even touch the quality of the camera for pictures. Night shot is solid, looking forward to Future tweeks to prevent the blown out appearance when some light is present.

Sound: Probably the only change I would make. The since downward firing speaker is easy to block. The quality is great - would love to see the dual speaker in the next OnePlus phone.

While you could say that OnePlus has made some sacrifices in developing the OnePlus 6T, they all seem rather subjective. Sure it’s a slightly bigger, thicker, heavier phone than the 6 but if that means a bigger battery with better longevity is it really a loss?
The headphone jack’s absence is annoying for some but the phone comes with an adapter and the in-display fingerprint sensor might not have fit in the same footprint otherwise."
62,Super
63,Damaged
64,"Phone functions are nice. Battery performance is not lasting good. Battery is dying very rapidly. I am changing full charge twice in 24hrs still battery is getting down to 19%. Most funny part is that I am hardly using my phone. This is very depressing after paying such a big amount (hard earned money) of Rs. 38000/- and battery performance is so much poor.
Spoken to the Amazon technical support for this. They have done some online test through some app and get to know that something is wrong with this phone battery and told me for the ""BRAND NEW REPLACEMENT PHONE"" on Monday 5th November 2018. I have received my phone on 2nd Nov and spoken to Amazon technical support engineer on 3rd Nov. Although I haven't received any email / SMS from Amazon yet. I can trust them on there words and will receive brand NEW REPLACEMENT PHONE on 5th November itself."
65,I purchased one plus 6t on nov 1st and gor it delivered on nov 3rd. Everything is fine but touch is not functioning properly at the corners of diaplay. Didn't expect such issue with onw plus
66,"Hello Guys,
I am using this phone past 2 days over all phone is good its worth to buy. But there are some issues which i am mentioning below.
1- battery is not so good, its draning fast not so fast but ya fast.
2- there is no am -pm in clock which very basic function in every damn phone.
3- you can face internet problem may be your sim doesn't support the handset. But there is issue.
4- performance what i was expecting is not top notch what company claiming. You can get same kind of speed in 20k phone easily.
5- lastly the finger scanning lock is not so fast, sometimes it takes 2-3 attempts.
Guys this is my geniune report about this phone. I m very much fan of oneplus family. But 2 times i took wrong decisions 1- for oneplus 5 it was a worst phone and
2- OnePlus 6t actually its not a worst phone but i was expecting a top notch speed. But OnePlus 6t not match that level.
If you have budget to buy and you want it anyhow than you can go for it.... Otherwise there are lots of better options. Available in market in 20k which match almost same quality & look. So don't waste your money if you don't have much in your pocket. Don't push your self to buy this phone.
I am give this phone 3 star just bcz its not that bad but its not that good. Now choices upto you."
67,Best pH ever..👍👍👌👌
68,"Adding another call, when a call is already in progress is night mare. Either app crashes or it doesnt allow. During phone call disabling blue tooth is not posisble. I see lot of UI issues. God only why people were so hyped about this phone. its not doing what 7000rs Samsung phone does. Please don't buy this phone and waste your money."
69,I got a defective product
70,"Things are not the same as promoted, I bought this on 2nd Nov, look wise its good, sound is also loud, its just loud nothin else, battery has just improved marginally if you keep your location on and play some game or video, it will be low very soon. Ofcourse at the end it will hang little longer but not as expected. Display Hangs!! Yes!!! this phone hangs even with 8gb RAM, have faced it few times even in first 10 days. Worst part is the front screen lock is too too slow, even i have to use pin code most of the time. Overall the phone launch was just a hype but the performance is not upto the expectation!!!"
71,38000 price not good
72,very bad
73,"I am using oneplus 6t phone from 1st of November and I am facing issue with camera when I m using camera with flash then image taking blur and in yellow colour this issue I am facing after updating oneplus 6t phone
"
74,Add/ enable proper always on display.. without LED notification light we can't see notification.. really not satisfied disabled always on display/Ambiant display…
75,As the slogan says never settle....proper flagship killer
