id,reviewContent
76,"Battery life is better. Picture quality is good. Sound quality is also reasonably good but definitely not the best among its competitors. Having said that, this phone is really really fast. Display is awesome. Dash charger is wow as usual."
77,I like this product very much
78,"Purchased with great excitement but disappointed the day i got this phone.. Being a flagship killer, i never expected this phone to face heat issues even with a normal usage..the same problem didn't arise with my brother's phone which he took on the same day... Apps didn't download but some how solved that issue later.. And now some apps are force closing and not working.. Remaining features live upto the mark. But being a oneplus fan, my expectations were sky-high about the 6t..slightly disappointed but not a big deal.. Can adjust with this."
79,picture quality is worst
80,Worst service from amazon.never expected this.lost believe in this.they delivered defective piece and not providing the replacement for this.Horrible ecperience
81,"No headphone jack! Just bigger battery and water drop notch. No camera improvement, below expectations.... Don't buy this phone just wait for oneplus7 ( hope some exiting features)... If you have oneplus 6 then don't buy it because no major ( even minor) improvement in it ( 6 is better than 6t) and if you are not a oneplus user then also don't buy it. I was so excited about this phone but disappointed."
82,Never buy this phone worst experience ever hopless phone
83,"For the cost , this is one value for money product. It is feature rich and perfect for a person like me. Am an avid foodie and traveller. This is a perfect phone to capture what I want whenever I want . And with amazing clarity. Also amazing speed . I became a fan with OnePlus 3 and this one has be convinced that this is one of the best smart phone options out there."
84,"pros:-1.gorilla glass 6
2.battery3700mah,
3.fast face unlock,
4.overall good quality camera,
5.no bloatware like samsung or mi phones,
6.fast performance with 6/8 gb ram ,and 845 processor,
7.128/256 gb storage,
8.optic amoled display,
9.both side glass with aluminium frame (with a free case),
10.fast fingerprint unlock(fixed with a software update),
11.fast charging with dash charger,
12.monthly security patch,and few major android update will expected to arrive in next few years,which is a big credit for oneplus.
13.no overheating issue,
cons:-1.battery drains fast,
2.no 3.5mm jack,
3.no stereo speaker
4.portrait mode photos are always not so good."
85,"The OnePlus 6T is undeniably the most advanced and accomplished phone from the company till now. The OnePlus 6 is still good, but the 6T gives it a boost in the battery department and a fancy way to unlock at a perfect price.
Cons :
Concern is the notification led light. we are not sure whether battery is 100% while charging. Single touch display to see notification is beautiful.
One plus should have added the charge + 3.5 jack in type c converter. which would be added value for those who watch movie or listen song while charging."
86,"Battery is terribly bad.
On round edges I lose the display as it cuts the actual view.
Sometimes AutoRotate does not work. I have to restart the mobile."
87,The discount could have been more
88,"I have purchased this phone and trusted amazon for over 2 years but now i am feeling stunned with the product quality.This phone gets switch off sometimes and getting ON only by hard rebooting but when i tried to return it , first a 3rd party app told me that your phone is all right. So if this kind of service is provided by amazon then i am not gonna do any kind of purchase from amazon.This is very bad.Worst service by amazon"
89,"Airtel Sim not working on new oneplus6t, Pathetic.
However other carriers are working"
90,I did prebook but I don't get bullet earphones
91,Not worth of price
92,"I have used two days and phone is good with speed and multi tasking but camera is worst, it did not meet even a normal 10000 rupees phone camera feature. I am planning to sell it out in OLX. Oneplus should stop increasing the phone size, since phone is slippery in the hand with 6.41 inches, always 6 or less than 6 inches phones are good to carry and handy."
93,Best phone i ever had
94,"I am experiencing very difficulty in receiving calls and I'm conversation with my callers THROUGH AIRTEL since it is being used for official purpose. In the 2nd slot BSNL sim. Although it is working but sometimes it also giving similar problem. Sound quality is poor, using full volume is require to hear the caller voice. I tried my best to exchange the device within the return period but failed as I experienced very difficulty in replacing the product with AMAZON THIS TIME.
MY PRESENT STATUS IS THAT SOME HOW I HAVE TO DISPOSED IT.
I FIND MORE BETTER WITH MY REDMI NOTE 5 PRO.
I am just waiting for 15-20 days as ONE PLUS CUSTOMER SERVICE CENTRE INFOM ME THAT IT WILL BE QUITE ALRIGHT AFTER AN UPGRADATION WICH IS ABOT TO COME WITHIN THE ABOVE TIME.
However, I can only say that being a prime member I maintained a higher expectations but disappointed. SORRY."
95,Hanging problem selfi camera not good
96,"Made a huge mistake in buying this phone.
Apple is far far far far far and far and again far better.
Best part amazon didn't accept for return"
97,good
98,"Annoyed by Amazon,i got a defective OnePlus 6t and Amazon is replacing it, and giving me excuse about seller. Its a suicide purchase for me.on screen fingerprint sensor is not working in my OnePlus 6t..and while setting fingerprint sensor it get swithed off with a loud beep sound..its kind of scary for me..pls help me guys what to do..i belong from small town..i hardly earn 20000. And i bought OnePlus 6t on a friend recommendation..i hv already sold my old phone.this is the only phone i am left with..and its a defective one..i bought it a the time of diwali when i got my salary in advance.. now my salary will come in last week of December.. i have been calling Amazon customer care from the day i purchased it and still no solutions.. feeling low..i hv given all my hard earned money buying this..dont know what to do..pls guide me.. Amazon pls help me..i m begging you."
99,"Pictures taken in daylight are decent. However, pictures taken during night are really really bad and the night mode doesn't give you the sort of pictures you would expect from an top end phone. Sound clarity over the calls is pretty bad. Battery life is decent at best. Now, coming to the in display fingerprint sensor it doesn't work all the time. It's way too slow and doesn't respond most of the time."
100,Lovely mobile... Simply love it.
101,Awesome phone midnight black is looks more beautiful
102,"I have been using this device for over a week now and so far it has turned out to be a beast of a device. Here are my observations:
1. The in-display screen unlocker: It is flawed. Takes a bit of a time to unlock and you have to place the finger properly. But this was not that big of a deal, since the face unlocking is supremely fast. Its a novelty kind of thing. looks nice when it works. 4/5 for this
2. Camera: my previous device was OP 5t. The picture quality has increased manifold. Nightscape, studio lighting and ultra slo-mo video works like a charm. 5/5 for this
3. Battery life: the first day, the device got slightly heated when i used oneplus switch so the battery drained quickly. But over the week, it has given me wonderful battery backup. No heating issue. With average to heavier usage, it still gave me 1.5 days backup. The charging is very fast. 40 minutes to charge from 10 to 95%. More than sufficient. 4.75/5 for this
4. Speaker: Only one speaker is present, but it gives out very loud output. Gives very good clarity and loud ringing. No complaints or issues regarding this. 5/5
5. OS: It is the cleanest and simplest OS yet. Lots and lots of customization, minimum bloatware. clean interface. in OP5T, the messaging app did not differentiate between marketing related messages and actual messages. fortunately, this phone has that capability. Loved the gestures as well. Optimizations are also great new feature. 5/5
6. Build: All one plus devices are wonderfully built and 6T is no exception. Even though the glass back is there, I didnt find any slippage. Of course I am using the back cover which is already provided with the phone now. But I think it has much better grip than the other phones. 5/5

Bottom line is that this is a device which you would want to own for a long time. Most of the budget phones start developing problems within 1 year of manufacturing, but that has not been my experience with One plus devices. Even after more than 1 year of using OP 5T, I still got the same performance I was getting during my first month with it. 6T is slightly costly but completely worth it in my opinion."
103,just superb
104,"Bad camera quality
I'm not satisfied with product take return"
105,"I waited for a long time for the Oneplus 6T model launch. I purchased it with lots of expectations and I am happy that it met my most of the expectations. I purchased Oneplus 6T 128gb and 6gb RAM version mirror black phone.

Pros :-

1) Super fast processor- can play large games without any glitch.

2) Camera is super amazing. However in the night mode, the pictures are sometimes hazy. Overall it is good.

3) The phone is damn beautiful. The back of the phone is simply outstanding. Notch also looks cute.

4) Fingerprint sensor is working fine.

5) Sound quality is good. The speakers are loud and bass is also good. However, the company should have launched it with dual speakers. It would have been phenomenal.

6) The company has increased the battery size. It gives a backup of atleast 1.5 days with normal usage.

Cons:-
1) NO HEADPHONE JACK. The company was making fun of Apple for removing the headphone jack, but they did the same. I just have a doubt that how will I charge my phone and watch a movie via earphones at the same time. I have to buy an external adapter which will put a dent on my pocket again.

2) If I am holding my phone and have put my thumb impression as my Fingerprint phone unlock option. Then sometimes it is difficult to unlock the phone. Coz while holding the phone I have to put my thumb straight which is quite difficult.

3) The night mode of the camera needs improvement.

4) No dual speaker.

Conclusion:

It is a nice phone with brilliant specifications. It easily beats some of the high end phones of Apple , Samsung and LG and others. So you may go for it."
106,"Here is my review of op6 McLaren Edn after 4 days of uses.
Camera is excellent, takes outstanding pictures. Sound quality is ok but not at par. Oneplus could have done better.
Battery life is phenomenal. Lasts for almost 30 hours with 10 hours of screen on time. Running 4g all the time.

The one and only con that I observed is internet speed is very slow . I saw someone's review before buying this phone that network strength is very good compared to other phones and indeed it is. But inspite of having good signals, the 4g internet speed is very slow. And I mean very slow like 2g. McLaren doesn't stand up to its name. Did all the tricks, read all the forums about the solution but nothing worked. Same sim is giving excellent speed in another phone.
I feel like cheated. Whats the point keeping superfast phone if you cannot have a fast internet.
Won't recommend anyone to buy this phone."
107,"I have bought OnePlus6T, its not a true value for money.

As per the price my ratings are as follows:
Music Quality 2/5.
Picture Quality 4/5 as compared to other mobile and 3/5 as compared to point and shoot cameras.
Sound Quality - 4.5/5
Settings and other user friendly features - 3/5 Samsung is better than this.
Availability of accessories 2/5, the accessories are costly and not easily available as well.
Bugs are also there, which company is not able to fix till now."
108,Phone is awesome camera check display check battery check... There is minor glitch with play store it is pathetic to download a new app as they always shows downloading or download pending.... Hope OnePlus will fix this…
109,"Overall amazing product for the price point .. but now its on the edge. One plus has been slowly increasing prices year on year and now they are in INR40K range. Further one or more price hikes and people will start going back to Flagship companies. Lets hope they keep it as Value for money.

Regarding phone:
Superb edge to edge display & battery life - No complaints here. 1080P screen is crisp enough and gives good battery life. Notch is actually just tiny camera and bottom chin has become further thinner.
Software: Oxygen OS - as usual its clean and gives stock experience with few customizations. Since phone has been just launched have experienced few bugs, but lets hope one plus gives quick updates to solve these.
Build Quality/looks: Thumbs Up! to OnePlus. Glass black and body design does give premium feel. But somehow felt phone is on heavier side (I have switched from OnePlus5 to OnePlus6T and definitely there's noticeable difference in weight).
Fingerprint scanner: Works well most of the times but not as fast as physical fingerprint scanners we have been used to of earlier phones. If screen gets smudgy you will have problem of unlocking device as it requires clean surface to work.
Only cons, I have experienced in this phone are No headphone jack and LED notification light. Most useful part of LED light was of charging notification. Now you have to wake screen and check. For headphones you do get C-Type connector but as it sounds ""No 3.5mm headphone Jack"" - nothing to describe here.

But overall its a good package and still its a Value for money! You can go for it for sure."
110,"Brought it on 3rd Nov. Attached is the list of issue
- GPS turn on automatically
- Bluetooth turn on Automatically
- Chrome hangs very now and then
- Screen Cast does not work / takes ages to connect
- InScreen fingerprint scanner is worst

Online support could not solve the problem , and ask to visit service center
Being the premium brand they have only 3 service center (???) in city like bangalore . One visit to MG Road will cost me whole day of my time. Just thinking again was it a good choice at all ???"
111,"Picture quality is not up to the mark, it's not as per the description given. Need to work hard on the same. Pic gets blurred when we zoom the camera. It states 20mp camera, but I don't think so that actually is."
112,"Best Android phone till date. I have been using it for 3 days now and OnePlus didn't let me down.
* Great battery life. I use mobile for texting, taking pics and pubg usually. I charge it once a day which is pretty great.
* Dash charging does help the phone to get charged to 90% in 50-60mins (3700mAh).
* You all know about the specs abt camera. But one thing to note is unlike oneplus 6, 6t's pro mode has bigger capture size.
* On screen finger print scanner amazes me each time I use it. Animation is so great. One thing i'd like to mention abt this animation is it is too bright even when brightness of the screen is minimum which is bad when you want to unlock ur phone at night time.

This is the best phone you can buy in 2018 and early 2019 at around 35-40k. So go ahead and buy it, I'm sure you won't regret it!"
113,Phone is good and phone sound was very good but battery is very bad I am not satisfied this phone
114,The alert slider is not working. Did not expect a defected piece from amazon. very disappointing. for replacement a technicuan from amazon will come and report. before that im left wid no phone. its so disheartening.
115,"AS I HAD ALREADY CUSTOMER OF ONE PLUS 5,IAM VERY MUCH DISAPPOINTED WITH PACKING MATERIAL OF ONE PLUS 6T, I COMPARE BOTH BOXES OF ONE PLUS 5 AND 6T
WHEN I PICK MY NEW PHONE 6T,I FOUND MATERIAL USED IS VERY DULL,MY FIRST IMPRESSION WAS 0
BUT OVERALL PHONE IS WORKING WELL WITH LESS BATTERY BACKUP"
116,"1. If you will see IPHONE then each application's UI will be the semetrical and properly handled, Unlike the oneplus 6T
if you will notice then while you are in CHAT then Bottom SEND and left SMILY button will not show 100% properly.
2. Without using any app it consumes 4+GB of RAM.
3. Camera quality is OK+ , Because its using almost same library of PIXEL phone, But not match that image processing quality. FRONT CAMERA QUALITY is just WROST ever if you will try on Artificial Light condition.
4. If you ZOOM once you took the picture it will not show the Best quality resolution.
4. If your phone will be in IDEAL mode for 10+ mins then your phone will be freeze for 7-8 Seconds."
117,"The phone is excellent software and internals wise. However the cons are as follows:

- all glass. Serves no purpose and makes the phone fragile
- no notification light
- no headphone jack. Pointless omission simply to ape Apple
- ambient display brightens up too much for sensing fingerprint and is very irritating at night
- phone is a tad too big. They should ideally have kept the 5.5 screen size from the op5 days and removed the bezels instead of increasing the size of the phone
- terrible vibration motor. My old nokias from the last decade had much better vibration. Not expected from such a premium phone"
118,My new one plus 6t is stucking a lot. Screen getting blank every time it get stucked. It stucked 5 times in last two days. Requesting you to please replace my phone.
119,"This is my first OnePlus Device and it feels amazing that how fast this phone is! I switched from Samsung Galaxy S7 Edge and I'm glad I did....Battery life is just outstanding and I've never ever got such a powerful battery ever in my smartphone life. It actually lasts more than a day with lots of playing (I'm a Gamer) and general usage. Camera is also very good and certainly better than my previous phone. UI is clean and lightning fast. Build quality and finish is premium, sturdy and not at all fragile. The in-box Type-C to 3.5mm Adapter solves the absence of headphone jack problem. The supplied case is of premium quality and easily gives all-round protection to any angle falls. Dash charging is superb too. Android Pie out-of-the-box is cool but restricts call recording from third party apps (which is must for me), but OP did a fantastic job of putting in-built call recorder which works flawlessly in Pie as well. As of now, I don't see a single negative point for this phone. Its truly a remarkable one! Thank You OnePlus and Amazon!"
120,"Camera is pathetic. Takes blurry pics sometimes. Pics gets detoriarated on little bit of zooming also. Looks like its a 8mp camera. Samsung takes better pics even in 8k phone. Low light is equally bad. Poor selfie camera. Those saying awesome camera have no idea about cameras. Improve camera performance in the next update.

Its blazzing fast. Smooth. Looks great. But cam and speakers r disappointment."
121,"They are exactly Working on their tag line ""the speed you need"". It's very fast. Very very fast. Talking about camera, that would have been better than op6. But nothing changed. Night scape is very good change. You can feel the light in nightscape mode. Audio is better than most of smartphones but not up to One plus mark. Battery life is best. You can rely on his battery for only one charge of half an hour with full day battery life even if you use it fully. Fingerprint scanner can't be better. New update help him open fast. If you have budget of 35k, buy it without second thought."
122,"The phone overall is supposed to be flagship killer. But the truth is that despite killing flagship it can’t kill the performance and stability of the previous model one plus 6. As someone who has both the phones in the family my observation is in comparison with one plus 6 and I feel one plus has gone down on the standards with the new phone.
Pros
Better sound than 6
Photos have better depth and clarity
Battery back up is good
Cons
Fingerprint unlock is absolutely lacking performance and does not work at times
Phone hangs at times and does not feel like it’s a one plus product or having 6 gb ram
Camera freezes and sometime renders all buttons including power button action less

Hope OnePlus comes with a sw update to handle all the issues, else this is gonna bring bad press for them."
123,"Mobile is too good , but product i received faulty , on 2 nd day I connected to charging by keeping g switch off and change sim card . it cant switched on . I placed immediately replacement order and Amazon take it properly. Thanks Amazon. But now I cancelled and all order."
124,"The product was defective. And amazon kept me on wait for 10 days for no reason to replace the phone,even it was manufacturing defects."
125,"This was for my sister. She previously had iphone 8 and believe me she loved the oneplus.
I am myself using a oneplus 6 and while comparing it with the T version.

There are only slight differences apartment from the notch size battery capacity and on screen fingerprint reader.

I particularly doesn't feel for the need for a quad HD screen since the screen quality is amazing.

They could have added bwtter camera modules and instead of the depth sensor , they could have put a telescopic lens

Speaker quality has improved from the 6 but they should have added stereo speakers.

I know some are xomolaing about the jack but sooner or later everyone will start using Bluetooth headphones, just like touch screen phone made a revolution.

The biggest upgrade that i personally feel is the 400mah increase in battery capacity.

I never had any issues with the 6 but the 6t wouod easily last 2 days for a moderate user"
126,"Firstly i would like to thank oneplus for making a device like that. The best part of the phone is the performance which you expect from a snapdragon 845 chip .. obviously you are paying for that.
(Or han"" don't do the math"" i have poco f1 too,, 6t is better in everything. worth paying more.. )

*Now the Issues are..
1. Lack of 3.5mm jack which can be a deal breaker for many people. But honestly not for me. Because i don't have a wired earphone or headphone. It's 2k18 even my car doesn't have an aux port. (Android auto). If still u want to use then there is a connector comes with the box.
2 . Notification led.
If they provided a led on the top of display then you have to compromise with that beautiful notch.
Again not a deal breaker.

*Important*
I have seen many people are saying in reviews. That they have not received cash back or type c bullet earphones with box. Not sure about. The cash back. But. If you pre book this device. It is mentioned that u will receive a code to purchase those earphones by 15 nov. U will not get those with the box..
And about the cash back i had purchased it at rs 46k(8ram 256rom) nd i received that 1000 instantly nd 500 on 5th nov.

Chaliye ab kuch buraiya bhi karde

*Sound quality can be better..
*Not ip certified. It is just splash proof (but i don't know how to swim so I'm not taking my phone in pool... again not a deal breaker)
Buss ab kharid lia or burai nhi hoti."
127,"Hello Guys, it’s been 1 week since I got (8GB/256GB) one of the best phone in market. As expected OnePlus deliver customs expectations.
Regarding phone it’s of course best in the market, battery charging takes around 75 minutes from 5% to 100%. Discharging is pretty normal compared to its competitors. Photo clarity is good enough in normal/ portrait mode but night mode I don’t feel good enough, it takes longer time to stabilise and we need to hold and wait. Video and photo clarity is good but not the best in market or less comparatively than my Lumia 950XL. Fingerprint sensor is not much sensitive and takes .5 to 1 sec to open, had a angle problem which resolved in recent update but still lag remains same. Face recognition is perfect. I feel phone is in top 5 for gaming with separate gaming mode, don’t see any lag in WCC 2/ Asphalt/ PUBG. Screen size, display is pretty good and as expected. Sound quality is same as it’s lower end models no much difference. Overall I am happy with other specifics except night mode, fingerprint sensor."
128,Had audio issues . Asked for replacement
129,"I am writing this review ,after usage of 15 days.

Phone is fabulous, build quality is also excellent.
Sound quality:
If you often listen music loudly then you may not like it, as it does not have dual speaker, so either buy a good JBL or Bose speakers or look for another phone.

Battery Life: Its Dash charge bro, my 6t got fully charged in 1:28 hours from 0to99.
Typical usage, may lead one or one and half day battery.(Typical means listening song, often watching YouTube or online movie etc.)
It gets slightly warm while charging , later I found that it's normal .
Software :It has oxygen is , except pixel of Google . One plus is the only brand in android to provide updates time to time. Software is also very smooth to use.

Hardware:Snapdragon 845 very fast,
Con:no qhd display,no led notification light.
Pros: On screen fingerprint ,very fast as compared to any other on screen fingerprint, but slightly slower than typical fingerprint.(Its 0.3sec., typical opens in0.15 to0.20sec)
I also noticed that of you kept your phone inactive for half an hour and suddenly use fingerprint on display it takes slightly more time than usual (approx. 0.8secto 0.6sec.) Later it will work fast and fine.
Service: Its a start up, so authorised one plus service centre are mostly in big cities like Bangalore,Pune , Mumbai, Delhi etc.
Summary:
GO FOR IT, I switched from iPhone 6s to one plus 6t , I don't regret it,and you will also."
